{
  "$schema": "https://json-schema.org/draft/2020-12/schema",
  "title": "socrates_top.json",
  "type": "array",
  "maxItems": 100,
  "items": {
    "type": "object",
    "required": ["id1", "name1", "id2", "name2", "tca", "range_km", "rel_speed_kms", "max_prob"],
    "properties": {
      "id1": {"type": "integer", "minimum": 1},
      "name1": {"type": "string", "maxLength": 64},
      "id2": {"type": "integer", "minimum": 1},
      "name2": {"type": "string", "maxLength": 64},
      "tca": {"type": "string", "pattern": "^\\d{4}-\\d{2}-\\d{2}[ T]\\d{2}:\\d{2}"},
      "range_km": {"type": "number", "minimum": 0},
      "rel_speed_kms": {"type": "number", "minimum": 0},
      "max_prob": {"type": "number", "minimum": 0, "maximum": 1}
    },
    "additionalProperties": false
  }
}
